{"analysis_release_state":"DISABLED_PENDING_SEMANTIC_REVIEW","authority":"PINNED_TOOL_IDENTITY_NO_EXECUTION_AUTHORITY","helper":{"sha256":"c7bec0e79de2551078245e040c188cbac73df2899cd5bf2049da7f44cc7c4a11","size_bytes":2424,"source_identity":"scripts/program_facts_evm_helper.py"},"manifest_sha256":"33ccd005e113db91000247d9263d0940cb5ad3c7811cde79e78aca646a48f5bc","parser":{"sha256":"356783aa0cfeac2b7cdd731262dea3748994fc5adec3208d11d6fca6631c4981","size_bytes":124515,"source_identity":"scripts/program_facts_evm_provider.py"},"raw_schema":{"sha256":"6b9f59fa032e52481527aede4c956c7553a87448458cb84517cc5ee6e27e3cea","size_bytes":9617,"source_identity":"rules/schemas/program_facts_evm_slither_raw.v1.schema.json"},"schema_version":"plamen.program_facts_evm_tool_manifest.v1","slither_distribution":{"name":"slither-analyzer","sdist_filename":"slither_analyzer-0.11.5.tar.gz","sdist_sha256":"d90af76b86bdf7ced56fc4c8eea8792cde1ec2c375372d5e70298c2ff998d5e1","version":"0.11.5","wheel_filename":"slither_analyzer-0.11.5-py3-none-any.whl","wheel_sha256":"3c7cb43651464543ed9152ed2f383dad4e15220b173754878ba6b291698be977"},"terminal_negative_authority":false}
